{
  "schema_version": "1.0.0",
  "run_id": "RUN-T1-GROUND-TRUTH",
  "document": {
    "product_name": "TBD - stakeholder input required",
    "document_version": "0.1",
    "author": "PRD Genie",
    "date": "2026-08-05",
    "status": "Draft"
  },
  "product_overview": {
    "value": "A reporting capability managed by PM Sarah that allows report filtering by date range, category, and status, with results loading in under 2 seconds.",
    "status": "grounded",
    "source_requirement_ids": ["FR-001", "NFR-001", "STK-001"]
  },
  "goals_and_objectives": {
    "business_goal": {
      "value": "TBD - stakeholder input required",
      "status": "tbd",
      "source_requirement_ids": []
    },
    "user_goal": {
      "value": "Filter reports by date range, category, and status.",
      "status": "grounded",
      "source_requirement_ids": ["FR-001"]
    },
    "success_metrics": [
      {
        "value": "Results load in under 2 seconds.",
        "status": "grounded",
        "source_requirement_ids": ["NFR-001"]
      }
    ]
  },
  "user_personas": [],
  "functional_requirements": [
    {
      "id": "FR-001",
      "requirement": "Users should be able to filter reports by date range, category, and status.",
      "priority": "Unspecified",
      "source_requirement_ids": ["FR-001"]
    }
  ],
  "non_functional_requirements": [
    {
      "id": "NFR-001",
      "requirement": "Results must load in under 2 seconds.",
      "category": "Performance",
      "target": "under 2 seconds",
      "source_requirement_ids": ["NFR-001"]
    }
  ],
  "acceptance_criteria": [
    {
      "id": "AC-001",
      "feature": "Report filtering",
      "criterion": "Reports can be filtered by date range, category, and status.",
      "source_requirement_ids": ["FR-001"]
    },
    {
      "id": "AC-002",
      "feature": "Report results",
      "criterion": "Results load in under 2 seconds.",
      "source_requirement_ids": ["NFR-001"]
    }
  ],
  "out_of_scope": [],
  "dependencies": [],
  "assumptions": [],
  "open_questions": [],
  "timeline": [
    {
      "milestone": "Deadline",
      "target_date": "Q3",
      "status": "grounded",
      "source_requirement_ids": ["DDL-001"]
    }
  ]
}
